member_id,role,status,body_length_mm,body_width_mm,body_depth_mm,instrument_height_mm,string_count,string_length_min_mm,string_length_max_mm,f_min_hz,f_max_hz,target_tension_kgf_per_string,playing_position,harness,release_notes
SAM-13-ROOT,root prototype,private review,650,150,200,810,13,200,580,196.0,659.3,5.0-7.0,seated body between thighs,none,Raised hull depth to 200 mm (D/L=0.31) 2026-05-16 per chang reference; zither pegs; slip-cast finial; keel soundport. G3 to E5 diatonic.
SAM-19-MID,mid concert,planned,850,196,280,1060,19,170,720,146.8,1567.9,5.5-7.5,seated with optional belt,low-back positioning belt with stern tether,Scaled-up family member; depth D/L=0.33; ~2.7 octaves D3 to G5; weight begins to want a belt.
SAM-25-CONCERT,concert,planned,1050,242,420,1310,25,150,860,110.0,1760.0,6.0-8.0,seated or standing,saxophone-style shoulder harness,Chang-proportioned (D/L=0.40); bow-end soundboard rose instead of keel-port; two multi-strip inlay bands; ~3.5 octaves A2 to A5; standing play requires harness; pickup recommended.
SAM-13-AE,acoustic-electric variant,planned,650,150,200,810,13,200,580,196.0,659.3,5.0-7.0,seated body between thighs,none,Same as SAM-13-ROOT with under-strip piezo + 1/4-inch output jack hidden in stern stub.
SAM-13-MULE,low-tension test mule,planned,650,150,200,810,13,200,580,196.0,659.3,3.0-4.5,seated body between thighs,none,Reduced-tension validation build for neck-joint and soundboard testing before full schedule.
